{
  "artifacts": {
    "activation_cases": {
      "count": 23,
      "owner": "researcher/fixtures/activation-cases.jsonl",
      "records": [
        {
          "digest": "sha256:9e84b1140ddf77e60af3e2e236d5d5a62dd3ca4fd7ad59932e281ad466554db8",
          "expected_primary_skill": "bdi-mental-states",
          "id": "activation-bdi-vs-memory",
          "line": 15
        },
        {
          "digest": "sha256:ac5786d2d1b2866d903f2df56be2d2458e979f8fe5e67f1d8021b092654649f3",
          "expected_primary_skill": "context-compression",
          "id": "activation-compression-vs-optimization",
          "line": 3
        },
        {
          "digest": "sha256:284a7f7dc3fe7da6364a5f9f9f1f9b77773f783b00400ae51db07ddfe81f039b",
          "expected_primary_skill": "context-degradation",
          "id": "activation-degradation-poisoning",
          "line": 16
        },
        {
          "digest": "sha256:b452f5dc7910a48ac388f01ddf455fa36dce84564bfdd0c7902ae0dc1fd6ae97",
          "expected_primary_skill": "evaluation",
          "id": "activation-evaluation-general-quality-gate",
          "line": 2
        },
        {
          "digest": "sha256:a13f96f409c041e7a79db8dcfc4f6f16546adb3e73257de9a0bb8cda8eb968fb",
          "expected_primary_skill": "advanced-evaluation",
          "id": "activation-evaluation-vs-advanced-judge",
          "line": 1
        },
        {
          "digest": "sha256:84ef54be54ef8bfe40510ebc4ad262228308b8cda41d750c049ad607b6136c0f",
          "expected_primary_skill": "filesystem-context",
          "id": "activation-filesystem-vs-memory",
          "line": 5
        },
        {
          "digest": "sha256:11b3418ee65209d9dfd72656fe85bd07cb4c7027608f6c4fe79c8825314642bb",
          "expected_primary_skill": "context-fundamentals",
          "id": "activation-fundamentals-onboarding",
          "line": 10
        },
        {
          "digest": "sha256:d861a44539acf68d65de8fa1369bbfeaa619787ffa0f069bfc79d7d3ab24d72f",
          "expected_primary_skill": "context-fundamentals",
          "id": "activation-fundamentals-vs-degradation",
          "line": 9
        },
        {
          "digest": "sha256:e69ccf3440044653c0e4023234a285d64aa4b8dea7a46f1e9eca5428de064b91",
          "expected_primary_skill": "context-fundamentals",
          "id": "activation-fundamentals-vs-optimization",
          "line": 11
        },
        {
          "digest": "sha256:c93c1142dfc36398c716f10dc7ae6ed8dcb4b5d7a3d252a297e70952cf219e06",
          "expected_primary_skill": "harness-engineering",
          "id": "activation-harness-vs-project",
          "line": 7
        },
        {
          "digest": "sha256:6609906b44c920e61e558d18845bbe9102f1bd68a66b0b8588ae66100999fef7",
          "expected_primary_skill": "hosted-agents",
          "id": "activation-hosted-vs-harness",
          "line": 17
        },
        {
          "digest": "sha256:42cfcae3dc69ea624c9231063f71c825b9fe819a29c33e8dc33e90515abb5476",
          "expected_primary_skill": "latent-briefing",
          "id": "activation-latent-briefing-vs-memory",
          "line": 18
        },
        {
          "digest": "sha256:9cb5207bd3f823630e62dc632b1ebd4bc5bfa3fb90968ad71dc29c8f3dee63ee",
          "expected_primary_skill": "long-horizon-prompting",
          "id": "activation-long-horizon-orchestrator-brief",
          "line": 23
        },
        {
          "digest": "sha256:3265d232f4415113799f4e32ff172a32673e5fa0fedc787259a4de050cc0909e",
          "expected_primary_skill": "long-horizon-prompting",
          "id": "activation-long-horizon-vs-multi-agent",
          "line": 22
        },
        {
          "digest": "sha256:79cc936e39cbcbf35bae50010e19614cf404ad39fd8839b463c081ad1e531368",
          "expected_primary_skill": "memory-systems",
          "id": "activation-memory-vs-filesystem",
          "line": 6
        },
        {
          "digest": "sha256:cf0523636dd07604980ec4a4add7460ddfa2a82b296e1e4bd8d6efa1ff27f4f3",
          "expected_primary_skill": "multi-agent-patterns",
          "id": "activation-multi-agent-topology",
          "line": 19
        },
        {
          "digest": "sha256:4b3e4760f303706452d8f8acd9dd8dd54836083bb9be57de1c4ba078b20de590",
          "expected_primary_skill": "context-optimization",
          "id": "activation-optimization-vs-compression",
          "line": 4
        },
        {
          "digest": "sha256:eb17cc7739511022e4eaae9819ab65d30b9a6ac2eb36c901e064997be3389a76",
          "expected_primary_skill": "project-development",
          "id": "activation-project-vs-harness",
          "line": 8
        },
        {
          "digest": "sha256:ff490ff825efd9f91fea70e185d0bc808f61d294361a7705edc15d25fdcecdcc",
          "expected_primary_skill": "self-improvement-loops",
          "id": "activation-self-improvement-evolutionary-search",
          "line": 21
        },
        {
          "digest": "sha256:777c66ea79a2b8a166086ab4f3255436fda2da0af5ba285bcbcc2ca63289b246",
          "expected_primary_skill": "self-improvement-loops",
          "id": "activation-self-improvement-vs-harness",
          "line": 20
        },
        {
          "digest": "sha256:569c70d63ac3f53acb93400db87bc099bfb1521a86df16d1bf72f155bb42cf29",
          "expected_primary_skill": "tool-design",
          "id": "activation-tool-consolidation",
          "line": 14
        },
        {
          "digest": "sha256:0cdc6d6c709ee9f24e627e36a219768c12ca548eb4cba4812e835b5c6bcca576",
          "expected_primary_skill": "tool-design",
          "id": "activation-tool-individual-tool",
          "line": 13
        },
        {
          "digest": "sha256:0f27b5bfe884491c3b1f8e81212ed143ee3d6dec3c64cbfb4eb4c6c66431bc08",
          "expected_primary_skill": "project-development",
          "id": "activation-tool-vs-project-structured-output",
          "line": 12
        }
      ]
    },
    "adversarial_goldens": {
      "count": 7,
      "owner": "researcher/benchmarks/goldens/adversarial-goldens.json",
      "records": [
        {
          "digest": "sha256:1d31958cac1f2f7e9d08e77e2a5964f7a2a19d7aa4f150dbfadb64d2d6c38c90",
          "expected_gate": "content_reject",
          "id": "adv-credible-generic-source"
        },
        {
          "digest": "sha256:d4f32ef7cf95b5a5a0dd9fc5733817312887e9809d6a6a8a1bf942eb27bfc8a0",
          "expected_gate": "novelty_human_review_or_duplicate",
          "id": "adv-duplicate-mechanism-reworded"
        },
        {
          "digest": "sha256:50eabccacd0f2d1e13c42a4f3c857c134d8909275b069e84ac3577d4f6c44690",
          "expected_gate": "human_review",
          "id": "adv-high-novelty-weak-evidence"
        },
        {
          "digest": "sha256:718b6d02433b52726e2a173baa63ca887d10055a2229d4eed5b96c4109394f09",
          "expected_gate": "human_review_stop",
          "id": "adv-self-approved-rubric-change"
        },
        {
          "digest": "sha256:267c5bb5394d32bf0758a04e35ce079c953bb25af4538a5b3918e1f2ed763b29",
          "expected_gate": "run_readiness_fail",
          "id": "adv-unretrieved-cited-evidence"
        },
        {
          "digest": "sha256:2b62726f2908461375565d7e84fc61c339573db09cfd6d250db988cfe3d76956",
          "expected_gate": "model_or_human_review",
          "id": "adv-verbose-no-behavior"
        },
        {
          "digest": "sha256:564083734bf1003321d6769f6c64e64a3356a7fb335ae4744d058a00d460d74f",
          "expected_gate": "repo_validation_fail",
          "id": "adv-wrong-rubric-math"
        }
      ]
    },
    "adversarial_scenarios": {
      "count": 7,
      "owner": "researcher/benchmarks/scenarios/*.jsonl",
      "records": [
        {
          "digest": "sha256:7b55edc0360366e45138eb9dc310083cd7a9f6c782989f7ce3859dbce4d418c3",
          "expected_gate": "content_reject",
          "id": "adv-credible-generic-source",
          "line": 2,
          "path": "researcher/benchmarks/scenarios/adversarial.jsonl"
        },
        {
          "digest": "sha256:29bfc7e265a6e01558d65e9b3168a145c606f9f17955099704bf756c190d260b",
          "expected_gate": "novelty_human_review_or_duplicate",
          "id": "adv-duplicate-mechanism-reworded",
          "line": 1,
          "path": "researcher/benchmarks/scenarios/adversarial.jsonl"
        },
        {
          "digest": "sha256:e76ce8a4aed6a8682f415018a06b9dd3ef3d59094e74e50e86e9ed6a3edb12cf",
          "expected_gate": "human_review",
          "id": "adv-high-novelty-weak-evidence",
          "line": 7,
          "path": "researcher/benchmarks/scenarios/adversarial.jsonl"
        },
        {
          "digest": "sha256:f1f33f8b377083bef5543ea55ab8fd9106824ea850a8d9063513db50bd665594",
          "expected_gate": "human_review_stop",
          "id": "adv-self-approved-rubric-change",
          "line": 6,
          "path": "researcher/benchmarks/scenarios/adversarial.jsonl"
        },
        {
          "digest": "sha256:f049c65ae90422b7357c374d6165635c45d4447c4cebc7b93867f2d3eecdbcd2",
          "expected_gate": "run_readiness_fail",
          "id": "adv-unretrieved-cited-evidence",
          "line": 3,
          "path": "researcher/benchmarks/scenarios/adversarial.jsonl"
        },
        {
          "digest": "sha256:19135d294c1a09054787d0832a144577de0527244c3e74b0b973f7cb011f9c12",
          "expected_gate": "model_or_human_review",
          "id": "adv-verbose-no-behavior",
          "line": 5,
          "path": "researcher/benchmarks/scenarios/adversarial.jsonl"
        },
        {
          "digest": "sha256:c5933de0258c23144c56aa54c3dd26bbe145874249be44fcd203acce53741f02",
          "expected_gate": "repo_validation_fail",
          "id": "adv-wrong-rubric-math",
          "line": 4,
          "path": "researcher/benchmarks/scenarios/adversarial.jsonl"
        }
      ]
    },
    "architecture_decisions": {
      "count": 10,
      "lifecycle": [
        "accepted",
        "deprecated",
        "proposed",
        "superseded"
      ],